{
  "jobId": "JOB-CHARACTER-FIRST-VISUALS-V1",
  "type": "long",
  "title": "Character-first visual production V1",
  "status": "review_required",
  "targetBranch": "chore/setup-agent-harness",
  "assignedRole": "builder",
  "description": "Add a character-first semi-automatic visual workflow for new projects, including versioned channel teacher characters, semantic asset concepts, prompt locking, bounded shot rhythm, motion metadata, and MP4/CapCut preview output while preserving legacy projects.",
  "businessContext": "The current pipeline can review shot assets but cannot persist a consistent channel character, map visual assets to semantic beats, or carry motion intent into preview and CapCut output. New videos need more varied visuals without breaking existing projects.",
  "allowedPaths": [
    "packages/domain/src/types.ts",
    "packages/domain/src/index.ts",
    "packages/domain/src/pipeline.ts",
    "packages/domain/src/workflowRegistry.ts",
    "packages/domain/src/workflowEligibility.ts",
    "packages/domain/src/workflowProgress.ts",
    "packages/domain/src/ipcSchemas.ts",
    "packages/domain/src/character.ts",
    "packages/domain/src/assetConcepts.ts",
    "packages/domain/src/motion.ts",
    "packages/domain/test/ipcSchemas.test.ts",
    "packages/domain/test/workflowEligibility.test.ts",
    "packages/domain/test/character.test.ts",
    "packages/domain/test/assetConcepts.test.ts",
    "packages/domain/test/motion.test.ts",
    "packages/db/src/projectRepository.ts",
    "packages/db/src/workflowRunStore.ts",
    "packages/db/test/persistence.test.ts",
    "packages/media/src/ffmpegPreview.ts",
    "packages/media/test/ffmpegPreview.test.ts",
    "apps/desktop/src/main/main.ts",
    "apps/desktop/src/main/assetAcquisitionService.ts",
    "apps/desktop/src/main/promptPreparationService.ts",
    "apps/desktop/src/main/promptPreparationService.test.ts",
    "apps/desktop/src/main/shotPlanService.ts",
    "apps/desktop/src/main/shotPlanService.test.ts",
    "apps/desktop/src/main/productionOrchestrator.ts",
    "apps/desktop/src/main/productionOrchestrator.test.ts",
    "apps/desktop/src/main/previewRenderService.ts",
    "apps/desktop/src/main/previewRenderService.test.ts",
    "apps/desktop/src/main/packagingExportService.ts",
    "apps/desktop/src/main/packagingExportService.test.ts",
    "apps/desktop/src/main/characterService.ts",
    "apps/desktop/src/main/characterService.test.ts",
    "apps/desktop/src/main/assetConceptService.ts",
    "apps/desktop/src/main/assetConceptService.test.ts",
    "apps/desktop/src/preload/preload.cjs",
    "apps/desktop/src/renderer/App.tsx",
    "apps/desktop/src/renderer/types.ts",
    "apps/desktop/src/renderer/services/factoryClient.ts",
    "apps/desktop/src/renderer/semiAutomaticWorkflow.ts",
    "apps/desktop/src/renderer/semiAutomaticWorkflow.test.ts",
    "apps/desktop/src/renderer/navigation.ts",
    "apps/desktop/src/renderer/navigation.test.ts",
    "apps/desktop/src/renderer/styles.css",
    ".harness/jobs/JOB-CHARACTER-FIRST-VISUALS-V1.json",
    ".harness/locks/JOB-CHARACTER-FIRST-VISUALS-V1.lock",
    ".harness/state.json",
    ".harness/handoffs/JOB-CHARACTER-FIRST-VISUALS-V1.md"
  ],
  "forbiddenPaths": [
    "packages/providers/**",
    "packages/generation-queue/**",
    "python/capcut_bridge/**",
    "docs/product/acceptance-criteria.md",
    "docs/product/open-questions.md"
  ],
  "dependencies": [
    "existing channel profile persistence",
    "existing 9Router text/image adapters",
    "existing workflow artifact store",
    "existing FFmpeg preview and CapCut packaging paths"
  ],
  "acceptanceCriteria": [
    "New projects default to the character-first visual workflow and persist the selected approved character version; legacy projects continue using their existing stage graph.",
    "A channel character version supports configurable teacher persona data, a 4-6 view identity pack with default five views, per-view retry, approval, active-version selection, and safe preview URLs.",
    "Visual stages cannot run for character-first projects until an approved character version is bound to the project.",
    "Asset Concepts produce validated per-semantic-beat asset cards and optional references before Prompt Preparation; the stage auto-advances after validation and retries failed items without placeholders.",
    "Prompt Preparation includes the character prompt lock, invariant traits, asset concepts, semantic beat, and motion intent and returns exactly one prompt for each AI shot.",
    "Shot planning targets 2-4 second visual beats, allows up to 5 seconds when necessary, and enforces a maximum of 20 AI-generated images per minute by reusing assets when appropriate.",
    "Motion metadata is restricted to the V1 effect catalog, can be overridden per shot, is approximated in FFmpeg preview, and is included in CapCut/export metadata.",
    "Provider failures stop at needs_attention with item-scoped retry and never insert placeholder media or expose raw secrets/errors.",
    "Focused domain, service, persistence, renderer, preview, and packaging tests plus typecheck and git diff check pass."
  ],
  "verificationCommands": [
    "corepack pnpm exec vitest run packages/domain/test/character.test.ts packages/domain/test/assetConcepts.test.ts packages/domain/test/motion.test.ts packages/domain/test/ipcSchemas.test.ts packages/domain/test/workflowEligibility.test.ts",
    "corepack pnpm exec vitest run apps/desktop/src/main/characterService.test.ts apps/desktop/src/main/assetConceptService.test.ts apps/desktop/src/main/promptPreparationService.test.ts apps/desktop/src/main/shotPlanService.test.ts apps/desktop/src/main/productionOrchestrator.test.ts apps/desktop/src/main/previewRenderService.test.ts packages/media/test/ffmpegPreview.test.ts",
    "corepack pnpm exec vitest run packages/db/test/persistence.test.ts apps/desktop/src/renderer/semiAutomaticWorkflow.test.ts apps/desktop/src/renderer/navigation.test.ts",
    "corepack pnpm typecheck",
    "git diff --check"
  ],
  "requiredReviewers": ["reviewer", "qa"],
  "maxReviewRounds": 3,
  "humanEscalationConditions": [
    "The existing provider API cannot safely generate the required identity or asset references without a forbidden provider-surface change.",
    "CapCut or FFmpeg cannot carry the V1 motion metadata without changing forbidden bridge code.",
    "Existing dirty changes prevent a safe bounded edit in an allowed path."
  ]
}
